{"generated_at":"2026-08-15T00:00:00Z","idempotency":{"canonical_payload_sha256":"0fc86dc3133ff3e1e8d9a686c7a3385df655ded54ab38ec60cfb027725dd6b78","key":"00000000-0000-4000-8000-000000000002","policy":"SAME_KEY_SAME_PAYLOAD_ONLY"},"planning":{"as_of_date":"2026-08-15","cancellation_risk":{"demand_adjustment":"ABSTENTION_NO_DEMAND_REDUCTION","gate_decision":"RESEARCH_GATE_NOT_PASSED_NO_SAAS_INTEGRATION","model_name":"cancellation_risk_catboost","presence_probability":"1.000000","presence_reason":"CATBOOST_RESEARCH_GATE_NOT_PASSED_CONSERVATIVE_NO_DISCOUNT"},"data_status":"SYNTHETIC_DEMO_NOT_RENTFLEET_HISTORY","demand_source":{"forecast_reference_sha256":"20e1cb681ede84bea14334ad9511b18e1c1f002189acd41fda39bcd61d9c1744","local_holdout_status":"not_available_pending_real_history","model_name":"hgb_poisson::regularized","model_version":"j5-v1","synthetic_demo":true},"distance_unit":"km","forecast_horizon":1,"moves":[{"distance_km":"42.000","from_node_ref":"SYNTH-NODE-001","operational_effect":"NO_OPERATIONAL_ACTION","reason_code":"EFFECTIVE_DEMAND_IMBALANCE","to_node_ref":"SYNTH-NODE-004","total_cost_centimes":42000,"unit_cost_centimes":21000,"vehicles":2},{"distance_km":"28.000","from_node_ref":"SYNTH-NODE-002","operational_effect":"NO_OPERATIONAL_ACTION","reason_code":"EFFECTIVE_DEMAND_IMBALANCE","to_node_ref":"SYNTH-NODE-003","total_cost_centimes":28000,"unit_cost_centimes":14000,"vehicles":2}],"nodes":[{"available_vehicles":3,"effective_demand":1,"forecast_demand":1,"node_ref":"SYNTH-NODE-001"},{"available_vehicles":4,"effective_demand":2,"forecast_demand":2,"node_ref":"SYNTH-NODE-002"},{"available_vehicles":3,"effective_demand":5,"forecast_demand":5,"node_ref":"SYNTH-NODE-003"},{"available_vehicles":1,"effective_demand":3,"forecast_demand":3,"node_ref":"SYNTH-NODE-004"}],"target_date":"2026-08-16"},"proposal_id":"00000000-0000-4000-8000-000000000001","safety":{"automatic_action_allowed":false,"contains_coordinates":false,"contains_direct_identifiers":false,"contains_real_customer_data":false,"human_decision_required":true,"local_validation_status":"NOT_VALIDATED_NO_REAL_HISTORY","operational_effect":"NO_OPERATIONAL_ACTION","operational_table_write_allowed":false,"synthetic_demo":true},"schema_version":"1.0.0","source":{"evidence_commit":"77479105049fa183f9e032e3207017b5348f6f1b","kind":"synthetic_demo","qualification_commit":"f71a80ac657c5ed58a8147e8535bdba60dddde0d","qualification_decision":"QUALIFIED_FOR_CONSULTATIVE_SAAS_INTEGRATION_REVIEW","solver_name":"ortools_simple_min_cost_flow","solver_status":"OPTIMAL","solver_version":"9.15.6755"},"summary":{"decision_cost_centimes":70000,"move_line_count":2,"node_count":4,"relocated_vehicle_count":4,"relocation_cost_centimes":70000,"served_demand":11,"service_rate":"1.000000","solver_runtime_ms":"0.032959","total_demand":11,"unserved_demand":0}}
